================================================================================
Hierarchical CE-SVM - Inverted Strategy
Dataset: Contraceptive
Timestamp: 2026-01-30 20:35:50
================================================================================

Loading training data from: /home/bs10081/Developer/NSVORA/Archive/contraceptive_split.xlsx

Loaded multi-class data:
  Class 1: 503 samples
  Class 2: 266 samples
  Class 3: 409 samples
  Features: 10
Training data loaded:
  Class 1: 503 samples
  Class 2: 266 samples
  Class 3: 409 samples
  Features: 10

================================================================================
Model Parameters
================================================================================
  C_hyper: 1.0
  epsilon: 0.0001
  M: 1000.0
  time_limit: 1800
  mip_gap: 0.0001
  threads: 0
  verbose: True
  enable_selection: True
  feat_upper_bound: 1000
  feat_lower_bound: 1e-07

================================================================================
Training Hierarchical Classifier - Inverted Strategy
================================================================================

Inverted Strategy:
  H1: medium class vs {majority, minority}
  H2: {medium, majority} vs minority
  (Class roles determined dynamically based on sample counts)

============================================================
Training Hierarchical CE-SVM (Strategy: inverted)
============================================================
Class 1: 503 samples
Class 2: 266 samples
Class 3: 409 samples
Features: 10

Dynamic Class Roles:
  Majority:  Class 1 (503 samples)
  Medium:    Class 3 (409 samples)
  Minority:  Class 2 (266 samples)

============================================================
Training H1: Class 3 (+1) vs {Class 1, 2} (-1)
============================================================
H1 Training samples: 1178
  Positive (+1): 409 samples
  Negative (-1): 769 samples

Set parameter TimeLimit to value 1800
Set parameter MIPGap to value 0.0001
Set parameter OutputFlag to value 1
Set parameter Threads to value 0
Gurobi Optimizer version 13.0.1 build v13.0.1rc0 (linux64 - "Ubuntu 24.04.3 LTS")

CPU model: AMD Ryzen 9 9900X 12-Core Processor, instruction set [SSE2|AVX|AVX2|AVX512]
Thread count: 20 physical cores, 20 logical processors, using up to 20 threads

Non-default parameters:
TimeLimit  1800

Optimize a model with 8268 rows, 4745 columns and 38020 nonzeros (Min)
Model fingerprint: 0x88b97a89
Model has 3556 linear objective coefficients
Variable types: 1201 continuous, 3544 integer (3544 binary)
Coefficient statistics:
  Matrix range     [1e-07, 2e+03]
  Objective range  [1e+00, 1e+00]
  Bounds range     [1e+00, 1e+00]
  RHS range        [1e+00, 2e+03]

Presolve removed 187 rows and 112 columns
Presolve time: 0.03s
Presolved: 8081 rows, 4633 columns, 38328 nonzeros
Variable types: 21 continuous, 4612 integer (3459 binary)
Found heuristic solution: objective 3534.0000000
Found heuristic solution: objective 3533.0000000
Found heuristic solution: objective 1176.0000000

Root relaxation: objective -4.676541e-01, 3321 iterations, 0.06 seconds (0.29 work units)

    Nodes    |    Current Node    |     Objective Bounds      |     Work
 Expl Unexpl |  Obj  Depth IntInf | Incumbent    BestBd   Gap | It/Node Time

     0     0   -0.46765    0  510 1176.00000   -0.46765   100%     -    0s
H    0     0                     265.0000000   -0.46765   100%     -    0s
H    0     0                     251.0000000   -0.46765   100%     -    0s
H    0     0                       0.0000000   -0.46765      -     -    0s
     0     0     cutoff    0         0.00000    0.00000  0.00%     -    0s

Cutting planes:
  Gomory: 6
  Implied bound: 254

Explored 1 nodes (3618 simplex iterations) in 0.17 seconds (0.62 work units)
Thread count was 20 (of 20 available processors)

Solution count 6: 0 251 265 ... 3534

Optimal solution found (tolerance 1.00e-04)
Best objective 0.000000000000e+00, best bound 0.000000000000e+00, gap 0.0000%

H1 Solution:
  Objective: 0.000000
  Selected features: 10/10
  L1 norm: 2.000000
  Positive accuracy lb: 1.0000
  Negative accuracy lb: 1.0000

============================================================
Training H2: Class {Class 3, 1} (+1) vs Class 2 (-1)
============================================================
H2 Training samples: 1178
  Positive (+1): 912 samples
  Negative (-1): 266 samples

Set parameter TimeLimit to value 1800
Set parameter MIPGap to value 0.0001
Set parameter OutputFlag to value 1
Set parameter Threads to value 0
Gurobi Optimizer version 13.0.1 build v13.0.1rc0 (linux64 - "Ubuntu 24.04.3 LTS")

CPU model: AMD Ryzen 9 9900X 12-Core Processor, instruction set [SSE2|AVX|AVX2|AVX512]
Thread count: 20 physical cores, 20 logical processors, using up to 20 threads

Non-default parameters:
TimeLimit  1800

Optimize a model with 8268 rows, 4745 columns and 38020 nonzeros (Min)
Model fingerprint: 0x14cf15dd
Model has 3556 linear objective coefficients
Variable types: 1201 continuous, 3544 integer (3544 binary)
Coefficient statistics:
  Matrix range     [1e-07, 2e+03]
  Objective range  [1e+00, 1e+00]
  Bounds range     [1e+00, 1e+00]
  RHS range        [1e+00, 2e+03]

Presolve removed 187 rows and 112 columns
Presolve time: 0.03s
Presolved: 8081 rows, 4633 columns, 38328 nonzeros
Variable types: 21 continuous, 4612 integer (3459 binary)
Found heuristic solution: objective 3534.0000000
Found heuristic solution: objective 3533.0000000
Found heuristic solution: objective 1176.0000000

Root relaxation: objective -6.680000e-01, 2838 iterations, 0.06 seconds (0.28 work units)

    Nodes    |    Current Node    |     Objective Bounds      |     Work
 Expl Unexpl |  Obj  Depth IntInf | Incumbent    BestBd   Gap | It/Node Time

     0     0   -0.66800    0  765 1176.00000   -0.66800   100%     -    0s
H    0     0                     531.0000000   -0.66800   100%     -    0s
     0     0    1.33000    0  770  531.00000    1.33000   100%     -    0s
     0     0    3.19695    0 2149  531.00000    3.19695  99.4%     -    0s
     0     0    3.49100    0  765  531.00000    3.49100  99.3%     -    0s
     0     0    5.04988    0 2094  531.00000    5.04988  99.0%     -    0s
     0     0    5.22540    0  765  531.00000    5.22540  99.0%     -    0s
     0     0    7.29799    0  764  531.00000    7.29799  98.6%     -    0s
     0     0    7.29840    0  764  531.00000    7.29840  98.6%     -    1s
     0     0    7.29840    0  765  531.00000    7.29840  98.6%     -    1s
     0     0    7.30040    0  766  531.00000    7.30040  98.6%     -    1s
     0     0    7.30263    0  767  531.00000    7.30263  98.6%     -    1s
     0     0    7.96514    0 2149  531.00000    7.96514  98.5%     -    1s
     0     0    8.14491    0 2160  531.00000    8.14491  98.5%     -    1s
     0     0    8.23186    0 2128  531.00000    8.23186  98.4%     -    1s
     0     0    8.24327    0 2147  531.00000    8.24327  98.4%     -    1s
     0     0    8.56745    0 1394  531.00000    8.56745  98.4%     -    1s
     0     0    8.56808    0 1394  531.00000    8.56808  98.4%     -    1s
     0     0    8.56808    0 1394  531.00000    8.56808  98.4%     -    1s
     0     0    8.56808    0 1394  531.00000    8.56808  98.4%     -    1s
     0     0    8.56808    0 1394  531.00000    8.56808  98.4%     -    1s
     0     2    8.56808    0 1394  531.00000    8.56808  98.4%     -    1s
   923   999   71.48859   46 2125  531.00000   10.75933  98.0%   268    5s
  8036  7051   21.75737   11 3086  531.00000   11.09615  97.9%  71.9   10s
 11458  9242  265.54862  155 1934  531.00000   26.62151  95.0%  65.5   15s
 11662  9410   34.96995   32 2364  531.00000   28.15650  94.7%  74.2   20s
 13140 10208  103.58044   77 1212  531.00000   28.15650  94.7%  82.4   25s
 16537 11421   61.05046   45 2962  531.00000   28.75431  94.6%  84.3   30s
 22436 13489  509.42581  263 2054  531.00000   29.41649  94.5%  77.2   35s
 27917 16506  530.46506  288 1758  531.00000   29.69069  94.4%  75.6   40s
 33381 18756  424.75717  210 2443  531.00000   29.95993  94.4%  74.2   45s
 41549 23355  266.38084  136 2594  531.00000   32.08555  94.0%  70.5   50s
 46697 24943  124.01344   69 1394  531.00000   32.17989  93.9%  69.5   58s
 46707 24950   83.36665   61 1938  531.00000   63.60529  88.0%  69.5   60s
 46728 24964  258.27313  129 2018  531.00000   69.75205  86.9%  69.5   65s
 46747 24976  180.16775  103 2013  531.00000   74.25931  86.0%  69.5   70s
 46766 24989  116.42334   74 1953  531.00000   76.74698  85.5%  69.4   75s
 46788 25004  482.84246  248 1978  531.00000   79.92438  84.9%  69.4   80s
 46809 25018   84.46365   47 2012  531.00000   84.46365  84.1%  69.4   85s
 46828 25030  258.27313  129 2007  531.00000   86.20024  83.8%  69.3   90s
 46844 25041   88.05937   34 1977  531.00000   88.05937  83.4%  69.3   95s
 46861 25052  493.22793  275 1984  531.00000   89.58092  83.1%  69.3  100s
 46881 25066  388.80817  187 2022  531.00000   91.72644  82.7%  69.3  105s
 46900 25078   94.50370   60 1984  531.00000   94.50370  82.2%  69.2  110s
 46919 25091  150.44491   88 1969  531.00000   96.47414  81.8%  69.2  115s
 46938 25104  437.38594  212 2014  531.00000   97.86475  81.6%  69.2  120s
 46949 25111   98.84107   44 1984  531.00000   98.84107  81.4%  69.2  127s
 46959 25118  279.64309  148 2000  531.00000  100.37130  81.1%  69.1  130s
 46980 25132  410.22676  219 1990  531.00000  101.59363  80.9%  69.1  135s
 46998 25144  102.81670   43 1999  531.00000  102.81670  80.6%  69.1  140s
 47014 25154  445.48380  196 1978  531.00000  103.67206  80.5%  69.1  145s
 47034 25168  106.56644   43 1989  531.00000  106.56644  79.9%  69.0  150s
 47051 25180  107.43995   67 1982  531.00000  107.43995  79.8%  72.2  155s
 47060 25186  281.32705  141 1973  531.00000  107.72736  79.7%  72.2  160s
 47071 25194  235.63269  117 1976  531.00000  108.29423  79.6%  72.2  165s
 47082 25201  109.29801   38 1970  531.00000  109.29801  79.4%  72.2  170s
 47096 25210  336.28346  179 1960  531.00000  109.84858  79.3%  72.1  175s
 47112 25221  243.29152  135 1975  531.00000  110.83049  79.1%  72.1  180s
 47126 25230  267.25146  122 1980  531.00000  111.15286  79.1%  72.1  185s
 47142 25241  114.54668   37 2026  531.00000  114.54668  78.4%  72.1  190s
 47159 25252  279.64309  148 1997  531.00000  115.89551  78.2%  72.0  195s
 47176 25264  116.65680   39 2009  531.00000  116.65680  78.0%  72.0  200s
 47190 25273  117.47115   62 1991  531.00000  117.47115  77.9%  72.0  205s
 47206 25284  367.18238  178 2003  531.00000  118.16566  77.7%  72.0  210s
 47224 25296  469.24761  226 2005  531.00000  119.13014  77.6%  71.9  215s
 47237 25304  119.46997   85 2024  531.00000  119.46997  77.5%  71.9  220s
 47253 25315  300.58825  148 1999  531.00000  120.50321  77.3%  71.9  225s
 47268 25325  121.25893   50 1959  531.00000  121.25893  77.2%  71.9  230s
 47285 25336  442.29720  239 2014  531.00000  122.06299  77.0%  71.8  235s
 47297 25344  124.01344   69 1965  531.00000  122.64056  76.9%  71.8  242s
 47328 25386  124.89646   53 2018  531.00000  124.04882  76.6%  74.5  245s
 47540 25538  128.66539   58 2062  531.00000  124.73110  76.5%  77.9  250s
 47723 25642  132.89392   62 2153  531.00000  124.73110  76.5%  80.2  255s
 48000 25852  136.69412   68 2202  531.00000  124.73110  76.5%  82.4  260s
 48271 25964  137.19970   72 1945  531.00000  124.73110  76.5%  83.8  265s
 48803 26227  140.49824   79 2066  531.00000  124.73110  76.5%  85.6  270s
 49335 26563  140.37699   85 1831  531.00000  124.73110  76.5%  86.8  275s
 50458 26988  145.74833   98 1922  531.00000  124.74511  76.5%  88.5  280s
 51344 27536  161.09518  110 1961  531.00000  124.74511  76.5%  89.7  285s
 53261 27870  208.45274  133 1885  531.00000  124.83150  76.5%  91.7  291s
 54027 27843 infeasible  147       531.00000  124.88021  76.5%  93.6  297s
 54075 27866  241.29779  149 1876  531.00000  124.88021  76.5%  94.3  301s
 54185 27878  248.51262  150 1659  531.00000  124.99267  76.5%  94.8  305s
 54263 27928  242.44049  152 1887  531.00000  124.99267  76.5%  95.4  312s
 54321 27969  244.43778  153 1881  531.00000  124.99267  76.5%  95.7  316s
 54398 28026  247.53185  154 1707  531.00000  124.99267  76.5%  96.1  320s
 54656 28294  256.73884  156 1698  531.00000  124.99267  76.5%  96.6  326s
 54980 28482  257.31994  157 1712  531.00000  124.99267  76.5%  97.0  330s
 55521 28644  262.44933  159 1915  531.00000  124.99267  76.5%  97.8  335s
 55664 28707  264.00001  160 1946  531.00000  124.99267  76.5%  98.7  340s
 55930 29004  283.19070  171 1660  531.00000  124.99267  76.5%   100  346s
 56475 29146  403.91742  236 1317  531.00000  125.11590  76.4%   100  351s
 56959 29343  134.65555   55 2312  531.00000  125.11590  76.4%   101  356s
 57305 29346  139.68840   62 2303  531.00000  125.11590  76.4%   102  360s
 57617 29466  146.45658   78 2146  531.00000  125.11590  76.4%   103  365s
 58424 29985  192.24074  123 2116  531.00000  125.45580  76.4%   104  371s
 59820 30723  134.32805   55 1828  531.00000  125.48745  76.4%   105  377s
 60560 30897  136.24241   59 1858  531.00000  125.48745  76.4%   104  380s
 61303 31648  145.77416   74 3011  531.00000  125.48745  76.4%   106  386s
 63998 33241  237.65699  243  750  531.00000  125.60759  76.3%   107  392s
 65508 33395  429.09586  411  271  531.00000  125.67859  76.3%   107  395s
 68280 33935  145.90148   70 1919  531.00000  125.80904  76.3%   108  402s
 68627 34992  150.80044   77 1919  531.00000  125.80904  76.3%   108  406s
 69935 37006  202.61425  127  908  531.00000  125.80904  76.3%   109  412s
 72707 36614  153.99302   66 2043  531.00000  125.80904  76.3%   110  415s
 74294 38041  181.60253  104 1883  531.00000  125.80904  76.3%   111  422s
 75526 38157  139.69357   58 2707  531.00000  125.80904  76.3%   112  426s
 76081 40111  146.15909   65 2687  531.00000  125.80904  76.3%   112  430s
 78844 40209  165.69098   99 2689  531.00000  126.51000  76.2%   112  437s
 80080 41365  332.55347  216 1528  531.00000  126.51000  76.2%   113  441s
 82008 42131  142.44122   59 2155  531.00000  126.51415  76.2%   114  445s
 84662 42032  157.55709   87 2119  531.00000  126.51415  76.2%   114  453s
 84725 42327  158.52921   88 2049  531.00000  126.51415  76.2%   114  457s
 85106 44534  162.43036   94 2087  531.00000  126.51415  76.2%   115  462s
 87738 44161  470.79371  286 2053  531.00000  126.51415  76.2%   114  466s
 88537 45412  147.42264   60 2376  531.00000  126.51415  76.2%   115  471s
 90226 46289  157.63588   75 2461  531.00000  126.51415  76.2%   116  477s
 91861 47867  164.89671   82 2456  531.00000  126.51415  76.2%   116  482s
 94216 51233  150.79454   58 2621  531.00000  127.02572  76.1%   117  491s
 98849 50699  153.72788   59 2454  531.00000  127.36675  76.0%   117  496s
 100000 53016  164.95615   71 2427  531.00000  127.36675  76.0%   118  502s
 103115 52588  422.90708  248 2602  531.00000  127.36675  76.0%   118  507s
 104270 55024  150.68494   58 2492  531.00000  127.36675  76.0%   119  512s
 107393 55750  163.24922   79 2326  531.00000  127.36675  76.0%   119  518s
 109419 56933  155.28287   62 2274  531.00000  127.36675  76.0%   119  523s
 111891 56878  162.77135   72 2616  531.00000  127.36675  76.0%   120  529s
 113107 58726  169.06186   88 2493  531.00000  127.36675  76.0%   121  534s
 116395 59222  184.86591  112 2140  531.00000  127.36675  76.0%   120  540s
 118564 61194  160.45365   63 2459  531.00000  127.36675  76.0%   121  548s
 121627 61786  202.84598  119 2556  531.00000  127.36675  76.0%   122  555s
 123586 62646  153.05658   58 2487  531.00000  128.99707  75.7%   122  561s
 125050 66668  172.35495   90 2537  531.00000  128.99707  75.7%   123  569s
 129651 67734  173.49537   62 2675  531.00000  128.99707  75.7%   123  575s
 130905 70464  190.21070   80 2561  531.00000  128.99707  75.7%   124  581s
 134008 71668  164.98718   64 2452  531.00000  128.99707  75.7%   124  587s
 135455 73995  179.44878   79 2565  531.00000  128.99707  75.7%   126  593s
 138227 75749  165.82904   62 2367  531.00000  128.99707  75.7%   126  600s
 140203 77847  185.08844   87 2011  531.00000  128.99707  75.7%   126  607s
 142659 79032  365.88381  212 1941  531.00000  128.99707  75.7%   127  613s
 144492 81955  167.52494   68 2417  531.00000  128.99707  75.7%   129  623s
 148685 84091  157.20146   57 2713  531.00000  130.95479  75.3%   128  630s
 151564 86548  172.72192   74 2563  531.00000  130.95479  75.3%   128  636s
 154557 87929  529.95987  297 1882  531.00000  131.12860  75.3%   128  642s
 156204 90297  161.69810   61 2706  531.00000  131.12860  75.3%   129  648s
 158933 91907  174.13535   78 2656  531.00000  131.12860  75.3%   129  654s
 160771 92510  458.60558  244 1808  531.00000  131.12860  75.3%   130  659s
 161435 94648  186.08700   64 2719  531.00000  131.12860  75.3%   131  666s
 164054 95300  247.69545  144 2550  531.00000  131.12860  75.3%   132  673s
 165490 96552  158.26670   58 2308  531.00000  131.12860  75.3%   132  682s
 168608 97892  166.75915   71 2682  531.00000  131.12860  75.3%   131  688s
 170691 99146  176.07952   90 2273  531.00000  131.12860  75.3%   132  695s
 173163 100553  179.95456   69 2596  531.00000  131.12860  75.3%   133  702s
 176842 102139  203.44728   97 2516  531.00000  131.12860  75.3%   132  709s
 179881 102822  172.37295   71 2562  531.00000  131.12860  75.3%   132  714s
 180801 105361  178.06961   77 2509  531.00000  131.12860  75.3%   132  721s
 183737 106702  229.55942  136 2465  531.00000  131.12860  75.3%   132  727s
 185258 109017  174.97453   58 2383  531.00000  131.12860  75.3%   133  733s
 187771 110264  192.74894   79 2272  531.00000  131.12860  75.3%   133  739s
 189371 110447  174.67717   59 2521  531.00000  131.12860  75.3%   134  745s
 189576 122802  180.41731   67 2471  531.00000  132.91493  75.0%   134  792s
 209396 123938  459.84517  224 1764  531.00000  134.02602  74.8%   135  799s
 211593 125483  177.88074   73 2397  531.00000  134.02602  74.8%   135  807s
 213638 127584  196.72819   94 2274  531.00000  134.02602  74.8%   135  813s
 216005 129540  183.22234   65 2538  531.00000  134.02602  74.8%   136  821s
 218267 131451  218.64270  118 2355  531.00000  134.02602  74.8%   136  828s
 220448 133332  180.01272   63 2567  531.00000  134.02602  74.8%   137  835s
 222588 134869  201.10655   89 2424  531.00000  134.02602  74.8%   137  843s
 224274 136533  287.33098  153 2172  531.00000  134.02602  74.8%   138  851s
 226330 138167  181.87754   72 2585  531.00000  134.02602  74.8%   138  858s
 228403 138864  190.39872   84 2209  531.00000  134.02602  74.8%   139  865s
 229738 141295  206.98959  101 2524  531.00000  134.02602  74.8%   140  874s
 235362 141315  182.82871   73 2870  531.00000  134.10431  74.7%   139  881s
 235382 141334  183.30942   74 2855  531.00000  134.10431  74.7%   139  888s
 235403 141353  184.43004   75 2842  531.00000  134.10431  74.7%   139  894s
 235424 141372  186.35862   76 2816  531.00000  134.10431  74.7%   139  901s
 235445 141390  187.74504   77 2840  531.00000  134.10431  74.7%   139  907s
 235467 141408  188.56261   78 2843  531.00000  134.10431  74.7%   139  914s
 235489 141427  188.57999   79 2874  531.00000  134.10431  74.7%   139  921s
 235510 141445  188.75541   80 2866  531.00000  134.10431  74.7%   139  928s
 235532 141463  190.07704   81 2829  531.00000  134.10431  74.7%   140  935s
 235554 141510  190.93078   82 2832  531.00000  134.10431  74.7%   140  942s
 235644 141648  191.24972   83 2816  531.00000  134.10431  74.7%   140  949s
 236015 141698  192.37889   84 2793  531.00000  134.56832  74.7%   139  959s
 236067 141933  193.87932   85 2858  531.00000  134.56832  74.7%   140  971s
 236338 141969  194.49753   86 2842  531.00000  134.56832  74.7%   140  978s
 236384 142169 infeasible   87       531.00000  134.56832  74.7%   140  986s
 236608 142213  197.15173   88 2850  531.00000  134.56832  74.7%   140  993s
 236660 156109  197.79564   89 2845  531.00000  134.56832  74.7%   140 1149s
 256660 159978  448.05854  232 1792  531.00000  135.27036  74.5%   141 1166s
 262194 161119  178.68029   61 2641  531.00000  135.31820  74.5%   141 1175s
 263593 164640  199.44458   79 2695  531.00000  135.31820  74.5%   142 1190s
 269090 166795  195.64117   72 2158  531.00000  135.57508  74.5%   142 1198s
 271863 168133  228.28228  128 2374  531.00000  135.57508  74.5%   142 1205s
 273455 169074  206.30393   75 2689  531.00000  135.57508  74.5%   143 1212s
 274694 171139  179.58637   58 2363  531.00000  135.57508  74.5%   144 1221s
 278083 171832  206.82224   78 2281  531.00000  135.57508  74.5%   144 1227s
 279036 173097  309.48679  165 1923  531.00000  135.57508  74.5%   145 1235s
 281504 174588  188.20064   86 2520  531.00000  135.57508  74.5%   146 1243s
 284670 176309  202.60014  100 3046  531.00000  135.80708  74.4%   146 1252s
 288481 177784  182.15761   84 1858  531.00000  135.82130  74.4%   146 1262s
 290585 180035  185.52128   66 3089  531.00000  135.82130  74.4%   147 1273s
 294450 181065  195.83422   76 2641  531.00000  135.82130  74.4%   147 1279s
 295800 183843  210.73135   91 2373  531.00000  135.82130  74.4%   148 1288s
 299390 185454  212.40963   67 1807  531.00000  136.23796  74.3%   148 1295s
 301285 187600  188.21574   76 2686  531.00000  136.23796  74.3%   149 1307s
 304126 189108  205.37543   99 2638  531.00000  136.23796  74.3%   149 1315s
 305905 190412  178.97594   63 2191  531.00000  136.23796  74.3%   149 1322s
 307482 191629  187.13496   71 2215  531.00000  136.23796  74.3%   150 1330s
 309169 194292  198.50693   83 1935  531.00000  136.23796  74.3%   150 1339s
 312823 196666  207.62366  101 1645  531.00000  136.23796  74.3%   150 1347s
 315671 198375  198.08043   85 2189  531.00000  136.61143  74.3%   151 1355s
 317795 199851  185.80399   62 2291  531.00000  136.61143  74.3%   151 1363s
 319621 200604  205.57622   81 2113  531.00000  136.61143  74.3%   152 1371s
 320515 203344  221.47482   99 2161  531.00000  136.61143  74.3%   152 1380s
 323769 204621  179.94274   59 2506  531.00000  136.61143  74.3%   152 1388s
 325166 207545  202.65585   79 2501  531.00000  136.61143  74.3%   153 1397s
 328595 208068  211.45982   76 2239  531.00000  136.61143  74.3%   153 1404s
 329173 209425  223.73478   89 3271  531.00000  136.61143  74.3%   154 1414s
 332435 211079  175.86681   60 2110  531.00000  136.61143  74.3%   153 1421s
 335746 213676  196.58050   85 2357  531.00000  136.61143  74.3%   153 1430s
 339457 214873  189.18072   74 3205  531.00000  136.61143  74.3%   153 1436s
 340774 217098  204.18167   92 2776  531.00000  136.61143  74.3%   153 1443s
 343436 218392  191.97036   88 2161  531.00000  136.61143  74.3%   153 1450s
 344910 219757  362.72859  183 1407  531.00000  136.61143  74.3%   154 1458s
 346536 220999  177.68884   58 2802  531.00000  136.61143  74.3%   154 1466s
 348504 223510  195.80472   79 2808  531.00000  136.61143  74.3%   154 1474s
 352154 225468  197.46131   82 2536  531.00000  136.61143  74.3%   154 1482s
 354679 226307  218.26594  101 2476  531.00000  136.61143  74.3%   154 1490s
 355626 227876  243.34043  131 2716  531.00000  136.63144  74.3%   155 1499s
 357689 228821  197.73381   70 3292  531.00000  136.63144  74.3%   155 1506s
 359423 231742  223.94739   96 3203  531.00000  137.55422  74.1%   155 1516s
 363876 232099  200.98363   82 2523  531.00000  137.55422  74.1%   155 1521s
 364252 233986  214.51085   95 2602  531.00000  138.05379  74.0%   155 1528s
 366273 235706  529.39844  293 1817  531.00000  138.05379  74.0%   155 1534s
 368405 237221  202.36277   84 2582  531.00000  138.05379  74.0%   156 1542s
 370121 239590  219.21695  104 2530  531.00000  138.05379  74.0%   156 1550s
 373006 241255  181.55711   58 2400  531.00000  138.05379  74.0%   156 1558s
 374870 241649  201.69197   74 2351  531.00000  138.05379  74.0%   156 1566s
 375318 243691  207.12675   80 2303  531.00000  138.05379  74.0%   156 1573s
 377642 245191  424.58858  230 2017  531.00000  138.05379  74.0%   157 1582s
 380372 247302  180.19016   61 2654  531.00000  138.05379  74.0%   157 1591s
 383049 249089  201.72925   84 2634  531.00000  138.05379  74.0%   157 1600s
 385134 251929  186.07453   61 2614  531.00000  138.05379  74.0%   157 1611s
 388393 253342  219.32875  105 2316  531.00000  138.05379  74.0%   157 1618s
 390104 255643  200.36580   65 2814  531.00000  138.05379  74.0%   157 1627s
 392743 257051  222.47900   88 3178  531.00000  138.05379  74.0%   158 1637s
 394337 259309  266.47300  130 3847  531.00000  138.05379  74.0%   158 1645s
 397007 260879  207.12766   91 3444  531.00000  138.05379  74.0%   158 1655s
 399750 261783  231.91430  137 4198  531.00000  138.05379  74.0%   158 1664s
 402141 263887  204.11933   62 2544  531.00000  138.05379  74.0%   158 1673s
 406108 266416  263.01987  128 2727  531.00000  138.05379  74.0%   158 1682s
 409759 266766  189.57564   66 2354  531.00000  138.09601  74.0%   158 1688s
 410146 268768  200.42459   75 2104  531.00000  138.09601  74.0%   158 1696s
 412476 270421  202.97715   66 2778  531.00000  138.09601  74.0%   158 1703s
 414332 272583  233.90355  103 2543  531.00000  138.09601  74.0%   158 1712s
 417231 274667  188.56887   65 2118  531.00000  138.09601  74.0%   158 1720s
 419830 275921  216.79548  106 2027  531.00000  138.09601  74.0%   159 1728s
 421219 277280  529.43114  282 1597  531.00000  138.09601  74.0%   159 1736s
 423065 279228  194.18966   86 3713  531.00000  138.09601  74.0%   159 1745s
 425860 280913  223.01078  120 3561  531.00000  138.09601  74.0%   159 1753s
 428475 283108  212.84736   69 2147  531.00000  139.67320  73.7%   160 1762s
 431364 285271  209.11003   63 2143  531.00000  139.68070  73.7%   160 1771s
 433933 287375  202.87159   83 1664  531.00000  139.68070  73.7%   160 1779s
 436400 288820  458.51345  227  637  531.00000  139.68070  73.7%   160 1787s
 438638 289715  191.05207   60 2443  531.00000  139.89025  73.7%   160 1794s
 439854 291545  211.10475   81 2175  531.00000  139.89025  73.7%   161 1800s

Cutting planes:
  Learned: 1
  Gomory: 390
  Cover: 2377
  Dual implied bound: 20
  MIR: 738
  Mixing: 1
  StrongCG: 8
  Flow cover: 711
  GUB cover: 59
  Inf proof: 294
  Zero half: 3
  Mod-K: 1
  RLT: 2
  Relax-and-lift: 18

Explored 442422 nodes (70827037 simplex iterations) in 1800.01 seconds (6134.23 work units)
Thread count was 20 (of 20 available processors)

Solution count 4: 531 1176 3533 3534 

Time limit reached
Best objective 5.310000000000e+02, best bound 1.398902477653e+02, gap 73.6553%
Time limit reached. Using best solution found (gap: 73.66%)

H2 Solution:
  Objective: 531.000000
  Selected features: 10/10
  L1 norm: 0.000000
  Positive accuracy lb: 1.0000
  Negative accuracy lb: 0.0000

============================================================
Training Complete!
============================================================

Training completed in: 0:30:00.318890

================================================================================
Model Summary
================================================================================
Status: fitted
Strategy: inverted
Features: 10

Class Roles:
  Majority: Class 1
  Medium:   Class 3
  Minority: Class 2

Classifier 1 (H1): Class 3 vs {Class 1, 2}
  Objective: 0.000000
  Selected Features: 10/10
  L1 Norm: 2.000000

Classifier 2 (H2): Class {Class 3, 1} vs Class 2
  Objective: 531.000000
  Selected Features: 10/10
  L1 Norm: 0.000000

================================================================================
Training Set Evaluation
================================================================================


============================================================
Evaluation Results
============================================================

Total Accuracy: 0.7742

Per-Class Accuracy:
  Class 1: 1.0000
  Class 2: 0.0000
  Class 3: 1.0000

Class Distribution:
  Class 1: 503 samples
  Class 2: 266 samples
  Class 3: 409 samples

Confusion Matrix:
     Pred 1  Pred 2  Pred 3
True 1:   503       0       0
True 2:   266       0       0
True 3:     0       0     409
============================================================
