================================================================================
Hierarchical CE-SVM - Inverted Strategy
Dataset: Squash_Unstored
Timestamp: 2026-01-31 17:41:48
================================================================================

Loading training data from: /home/bs10081/Developer/NSVORA/Archive/squash-unstored_split.xlsx

  Note: Excluding non-numeric columns: ['site', 'Acceptability']
Loaded multi-class data:
  Class 1: 19 samples
  Class 2: 19 samples
  Class 3: 3 samples
  Features: 23
Training data loaded:
  Class 1: 19 samples
  Class 2: 19 samples
  Class 3: 3 samples
  Features: 23

================================================================================
Model Parameters
================================================================================
  C_hyper: 1.0
  epsilon: 0.0001
  M: 1000.0
  time_limit: 1800
  mip_gap: 0.0001
  threads: 0
  verbose: True
  enable_selection: True
  feat_upper_bound: 1000
  feat_lower_bound: 1e-07

================================================================================
Training Hierarchical Classifier - Inverted Strategy
================================================================================

Inverted Strategy:
  H1: medium class vs {majority, minority}
  H2: {medium, majority} vs minority
  (Class roles determined dynamically based on sample counts)

============================================================
Training Hierarchical CE-SVM (Strategy: inverted)
============================================================
Class 1: 19 samples
Class 2: 19 samples
Class 3: 3 samples
Features: 23

Dynamic Class Roles:
  Majority:  Class 2 (19 samples)
  Medium:    Class 1 (19 samples)
  Minority:  Class 3 (3 samples)

============================================================
Training H1: Class 1 (+1) vs {Class 2, 3} (-1)
============================================================
H1 Training samples: 41
  Positive (+1): 19 samples
  Negative (-1): 22 samples

Set parameter TimeLimit to value 1800
Set parameter MIPGap to value 0.0001
Set parameter OutputFlag to value 1
Set parameter Threads to value 0
Gurobi Optimizer version 13.0.1 build v13.0.1rc0 (linux64 - "Ubuntu 24.04.3 LTS")

CPU model: AMD Ryzen 9 9900X 12-Core Processor, instruction set [SSE2|AVX|AVX2|AVX512]
Thread count: 20 physical cores, 20 logical processors, using up to 20 threads

Non-default parameters:
TimeLimit  1800

Optimize a model with 335 rows, 236 columns and 2641 nonzeros (Min)
Model fingerprint: 0x82999ffb
Model has 171 linear objective coefficients
Variable types: 90 continuous, 146 integer (146 binary)
Coefficient statistics:
  Matrix range     [1e-07, 3e+03]
  Objective range  [1e+00, 1e+00]
  Bounds range     [1e+00, 1e+00]
  RHS range        [1e+00, 4e+01]

Presolve removed 24 rows and 24 columns
Presolve time: 0.00s
Presolved: 311 rows, 212 columns, 2241 nonzeros
Variable types: 48 continuous, 164 integer (123 binary)
Found heuristic solution: objective 123.0000000
Found heuristic solution: objective 122.0000000
Found heuristic solution: objective 39.0000000
Found heuristic solution: objective 38.0147705

Root relaxation: objective -1.964042e+00, 152 iterations, 0.00 seconds (0.00 work units)

    Nodes    |    Current Node    |     Objective Bounds      |     Work
 Expl Unexpl |  Obj  Depth IntInf | Incumbent    BestBd   Gap | It/Node Time

     0     0   -1.96404    0   51   38.01477   -1.96404   105%     -    0s
H    0     0                      36.0147705   -1.96404   105%     -    0s
H    0     0                       3.1687073   -1.96404   162%     -    0s
H    0     0                      -1.4172596   -1.96404  38.6%     -    0s

Cutting planes:
  Gomory: 1

Explored 1 nodes (152 simplex iterations) in 0.01 seconds (0.01 work units)
Thread count was 20 (of 20 available processors)

Solution count 7: -1.41726 3.16871 36.0148 ... 123
No other solutions better than -1.41726

Optimal solution found (tolerance 1.00e-04)
Best objective -1.417259587225e+00, best bound -1.417259587225e+00, gap 0.0000%

H1 Solution:
  Objective: -1.417260
  Selected features: 23/23
  L1 norm: 0.582740
  Positive accuracy lb: 1.0000
  Negative accuracy lb: 1.0000

============================================================
Training H2: Class {Class 1, 2} (+1) vs Class 3 (-1)
============================================================
H2 Training samples: 41
  Positive (+1): 38 samples
  Negative (-1): 3 samples

Set parameter TimeLimit to value 1800
Set parameter MIPGap to value 0.0001
Set parameter OutputFlag to value 1
Set parameter Threads to value 0
Gurobi Optimizer version 13.0.1 build v13.0.1rc0 (linux64 - "Ubuntu 24.04.3 LTS")

CPU model: AMD Ryzen 9 9900X 12-Core Processor, instruction set [SSE2|AVX|AVX2|AVX512]
Thread count: 20 physical cores, 20 logical processors, using up to 20 threads

Non-default parameters:
TimeLimit  1800

Optimize a model with 335 rows, 236 columns and 2641 nonzeros (Min)
Model fingerprint: 0xfd8bd4b7
Model has 171 linear objective coefficients
Variable types: 90 continuous, 146 integer (146 binary)
Coefficient statistics:
  Matrix range     [1e-07, 3e+03]
  Objective range  [1e+00, 1e+00]
  Bounds range     [1e+00, 1e+00]
  RHS range        [1e+00, 8e+01]

Found heuristic solution: objective 10.0524633
Presolve removed 24 rows and 24 columns
Presolve time: 0.00s
Presolved: 311 rows, 212 columns, 2241 nonzeros
Variable types: 48 continuous, 164 integer (123 binary)

Root relaxation: objective -1.986042e+00, 59 iterations, 0.00 seconds (0.00 work units)

    Nodes    |    Current Node    |     Objective Bounds      |     Work
 Expl Unexpl |  Obj  Depth IntInf | Incumbent    BestBd   Gap | It/Node Time

     0     0   -1.98604    0   13   10.05246   -1.98604   120%     -    0s
H    0     0                       2.3408301   -1.98604   185%     -    0s
H    0     0                      -1.9359282   -1.98604  2.59%     -    0s

Explored 1 nodes (60 simplex iterations) in 0.01 seconds (0.01 work units)
Thread count was 20 (of 20 available processors)

Solution count 3: -1.93593 2.34083 10.0525 
No other solutions better than -1.93593

Optimal solution found (tolerance 1.00e-04)
Best objective -1.935928150523e+00, best bound -1.935928150523e+00, gap 0.0000%

H2 Solution:
  Objective: -1.935928
  Selected features: 23/23
  L1 norm: 0.064072
  Positive accuracy lb: 1.0000
  Negative accuracy lb: 1.0000

============================================================
Training Complete!
============================================================

Training completed in: 0:00:00.022047

================================================================================
Model Summary
================================================================================
Status: fitted
Strategy: inverted
Features: 23

Class Roles:
  Majority: Class 2
  Medium:   Class 1
  Minority: Class 3

Classifier 1 (H1): Class 1 vs {Class 2, 3}
  Objective: -1.417260
  Selected Features: 23/23
  L1 Norm: 0.582740

Classifier 2 (H2): Class {Class 1, 2} vs Class 3
  Objective: -1.935928
  Selected Features: 23/23
  L1 Norm: 0.064072

================================================================================
Training Set Evaluation
================================================================================


============================================================
Evaluation Results
============================================================

Total Accuracy: 1.0000

Per-Class Accuracy:
  Class 1: 1.0000
  Class 2: 1.0000
  Class 3: 1.0000

Class Distribution:
  Class 1: 19 samples
  Class 2: 19 samples
  Class 3: 3 samples

Confusion Matrix:
     Pred 1  Pred 2  Pred 3
True 1:    19       0       0
True 2:     0      19       0
True 3:     0       0       3
============================================================

================================================================================
Test Set Evaluation
================================================================================

Loading test data (skiprows=4)...
  Note: Excluding non-numeric columns: ['site', 'Acceptability']
Loaded multi-class data:
  Class 1: 5 samples
  Class 2: 5 samples
  Class 3: 1 samples
  Features: 22
Test data loaded:
  Class 1: 5 samples
  Class 2: 5 samples
  Class 3: 1 samples

Warning: Could not load or evaluate test data: matmul: Input operand 1 has a mismatch in its core dimension 0, with gufunc signature (n?,k),(k,m?)->(n?,m?) (size 23 is different from 22)
Skipping test set evaluation.

================================================================================
Test Complete!
================================================================================
Training Duration: 0:00:00.022047
Training Accuracy: 1.0000
Log saved to: /home/bs10081/Developer/hcesvm/results/inverted_Squash_Unstored_20260131_174148.log
================================================================================
