================================================================================
Hierarchical CE-SVM - TEST3 Strategy
Dataset: Hayes_Roth
Timestamp: 2026-02-10 19:33:54
================================================================================

Training data:
  Class 1: 40 samples
  Class 2: 41 samples
  Class 3: 24 samples
  Features: 4

================================================================================
Model Parameters
================================================================================
  C_hyper: 1.0
  epsilon: 0.0001
  M: 1000.0
  time_limit: 1800
  mip_gap: 0.0001
  threads: 0
  verbose: True
  enable_selection: True
  feat_upper_bound: 1000
  feat_lower_bound: 1e-07

================================================================================
Training Hierarchical Classifier - TEST3 Strategy
================================================================================

Test3 Strategy:
  H1: {minority, medium} vs majority
  H2: minority vs medium
  Sample-weighted objective: -(1/s+)·l+ - (1/s-)·l-

============================================================
Training Hierarchical CE-SVM (Strategy: test3)
============================================================
Class 1: 40 samples
Class 2: 41 samples
Class 3: 24 samples
Features: 4

Dynamic Class Roles:
  Majority:  Class 2 (41 samples)
  Medium:    Class 1 (40 samples)
  Minority:  Class 3 (24 samples)

============================================================
Training H1: Class 3 (+1) vs {Class 1, 2} (-1)
============================================================
H1 Training samples: 105
  Positive (+1): 24 samples
  Negative (-1): 81 samples
  Class weight: balanced
  Accuracy mode: both

Set parameter TimeLimit to value 1800
Set parameter MIPGap to value 0.0001
Set parameter OutputFlag to value 1
Set parameter Threads to value 0
Gurobi Optimizer version 13.0.1 build v13.0.1rc0 (linux64 - "Ubuntu 24.04.3 LTS")

CPU model: AMD Ryzen 9 9900X 12-Core Processor, instruction set [SSE2|AVX|AVX2|AVX512]
Thread count: 20 physical cores, 20 logical processors, using up to 20 threads

Non-default parameters:
TimeLimit  1800

Optimize a model with 745 rows, 435 columns and 2441 nonzeros (Min)
Model fingerprint: 0x04f7178e
Model has 325 linear objective coefficients
Variable types: 116 continuous, 319 integer (319 binary)
Coefficient statistics:
  Matrix range     [1e-07, 1e+03]
  Objective range  [1e-02, 1e+00]
  Bounds range     [1e+00, 1e+00]
  RHS range        [1e+00, 2e+02]

Presolve removed 321 rows and 186 columns
Presolve time: 0.00s
Presolved: 424 rows, 249 columns, 1290 nonzeros
Variable types: 9 continuous, 240 integer (180 binary)
Found heuristic solution: objective 315.0000000
Found heuristic solution: objective 314.0000000
Found heuristic solution: objective 104.9459877

Root relaxation: objective 6.607099e-02, 164 iterations, 0.00 seconds (0.00 work units)

    Nodes    |    Current Node    |     Objective Bounds      |     Work
 Expl Unexpl |  Obj  Depth IntInf | Incumbent    BestBd   Gap | It/Node Time

     0     0    0.06607    0   72  104.94599    0.06607   100%     -    0s
H    0     0                      47.9876543    0.06607   100%     -    0s
     0     0    2.34458    0  125   47.98765    2.34458  95.1%     -    0s
H    0     0                      40.4652373    2.99168  92.6%     -    0s
H    0     0                      33.4582928    2.99168  91.1%     -    0s
     0     0    2.99168    0   78   33.45829    2.99168  91.1%     -    0s
     0     0    3.05243    0   75   33.45829    3.05243  90.9%     -    0s
     0     0    5.39313    0   86   33.45829    5.39313  83.9%     -    0s
     0     0    5.56155    0   84   33.45829    5.56155  83.4%     -    0s
     0     0    5.56454    0   86   33.45829    5.56454  83.4%     -    0s
     0     0    5.56762    0   88   33.45829    5.56762  83.4%     -    0s
H    0     0                      31.9549730    8.26399  74.1%     -    0s
H    0     0                      30.9532369    8.26399  73.3%     -    0s
     0     0    8.26399    0   94   30.95324    8.26399  73.3%     -    0s
     0     0    8.31979    0  104   30.95324    8.31979  73.1%     -    0s
     0     0    8.34514    0   97   30.95324    8.34514  73.0%     -    0s
     0     0    8.34988    0  101   30.95324    8.34988  73.0%     -    0s
     0     0    8.35090    0  103   30.95324    8.35090  73.0%     -    0s
H    0     0                      29.9532369    8.35090  72.1%     -    0s
H    0     0                      24.9515008    8.35090  66.5%     -    0s
H    0     0                      20.9497647    9.08476  56.6%     -    0s
     0     0    9.08476    0   82   20.94976    9.08476  56.6%     -    0s
     0     0    9.10923    0   85   20.94976    9.10923  56.5%     -    0s
     0     0    9.12996    0   87   20.94976    9.12996  56.4%     -    0s
     0     0    9.13214    0   87   20.94976    9.13214  56.4%     -    0s
     0     0    9.35660    0   99   20.94976    9.35660  55.3%     -    0s
     0     0    9.67894    0  109   20.94976    9.67894  53.8%     -    0s
     0     0    9.79026    0  116   20.94976    9.79026  53.3%     -    0s
     0     0    9.80537    0  101   20.94976    9.80537  53.2%     -    0s
     0     0    9.81741    0  109   20.94976    9.81741  53.1%     -    0s
     0     0    9.81995    0  113   20.94976    9.81995  53.1%     -    0s
     0     0   10.40696    0  106   20.94976   10.40696  50.3%     -    0s
     0     0   10.58860    0   86   20.94976   10.58860  49.5%     -    0s
     0     0   10.63846    0   80   20.94976   10.63846  49.2%     -    0s
     0     0   10.65332    0   88   20.94976   10.65332  49.1%     -    0s
     0     0   10.65386    0   89   20.94976   10.65386  49.1%     -    0s
     0     0   10.71636    0   98   20.94976   10.71636  48.8%     -    0s
     0     0   10.76648    0  103   20.94976   10.76648  48.6%     -    0s
     0     0   10.76648    0  105   20.94976   10.76648  48.6%     -    0s
     0     0   10.76908    0  107   20.94976   10.76908  48.6%     -    0s
     0     0   10.76948    0  106   20.94976   10.76948  48.6%     -    0s
     0     0   10.81431    0  103   20.94976   10.81431  48.4%     -    0s
     0     0   10.81912    0  105   20.94976   10.81912  48.4%     -    0s
     0     0   10.81912    0  105   20.94976   10.81912  48.4%     -    0s
     0     0   10.89150    0  113   20.94976   10.89150  48.0%     -    0s
     0     0   11.02112    0  113   20.94976   11.02112  47.4%     -    0s
     0     0   11.03857    0  104   20.94976   11.03857  47.3%     -    0s
     0     0   11.05861    0   98   20.94976   11.05861  47.2%     -    0s
     0     0   11.06365    0  101   20.94976   11.06365  47.2%     -    0s
     0     0   11.06714    0  111   20.94976   11.06714  47.2%     -    0s
     0     0   11.19780    0   99   20.94976   11.19780  46.5%     -    0s
     0     0   11.26750    0  107   20.94976   11.26750  46.2%     -    0s
     0     0   11.27309    0  108   20.94976   11.27309  46.2%     -    0s
     0     0   11.27449    0  108   20.94976   11.27449  46.2%     -    0s
     0     0   11.33717    0  104   20.94976   11.33717  45.9%     -    0s
     0     0   11.39797    0  102   20.94976   11.39797  45.6%     -    0s
     0     0   11.40560    0  112   20.94976   11.40560  45.6%     -    0s
     0     0   11.40861    0   99   20.94976   11.40861  45.5%     -    0s
     0     0   11.40901    0  105   20.94976   11.40901  45.5%     -    0s
     0     0   11.41128    0  105   20.94976   11.41128  45.5%     -    0s
     0     0   11.41128    0  106   20.94976   11.41128  45.5%     -    0s
     0     0   11.41334    0  106   20.94976   11.41334  45.5%     -    0s
     0     0   11.41334    0  106   20.94976   11.41334  45.5%     -    0s
     0     2   11.41334    0  106   20.94976   11.41334  45.5%     -    0s

Cutting planes:
  Learned: 1
  Gomory: 17
  Cover: 14
  Implied bound: 33
  MIR: 138
  Flow cover: 95
  Inf proof: 39
  RLT: 1

Explored 2614 nodes (68963 simplex iterations) in 0.41 seconds (0.57 work units)
Thread count was 20 (of 20 available processors)

Solution count 10: 20.9498 24.9515 29.9532 ... 314

Optimal solution found (tolerance 1.00e-04)
Best objective 2.094976470812e+01, best bound 2.094976470812e+01, gap 0.0000%

H1 Solution:
  Weights (w): [0. 1. 1. 1.]
  Intercept (b): -7.0
  Objective: 20.949765
  Selected features: 4/4
  L1 norm: 3.000000
  Positive accuracy lb: 0.9167
  Negative accuracy lb: 0.9753

============================================================
Training H2: Class {2, 3} (+1) vs Class 1 (-1)
============================================================
H2 Training samples: 105
  Positive (+1): 65 samples
  Negative (-1): 40 samples
  Class weight: balanced
  Accuracy mode: both

Set parameter TimeLimit to value 1800
Set parameter MIPGap to value 0.0001
Set parameter OutputFlag to value 1
Set parameter Threads to value 0
Gurobi Optimizer version 13.0.1 build v13.0.1rc0 (linux64 - "Ubuntu 24.04.3 LTS")

CPU model: AMD Ryzen 9 9900X 12-Core Processor, instruction set [SSE2|AVX|AVX2|AVX512]
Thread count: 20 physical cores, 20 logical processors, using up to 20 threads

Non-default parameters:
TimeLimit  1800

Optimize a model with 745 rows, 435 columns and 2441 nonzeros (Min)
Model fingerprint: 0x601546f4
Model has 325 linear objective coefficients
Variable types: 116 continuous, 319 integer (319 binary)
Coefficient statistics:
  Matrix range     [1e-07, 1e+03]
  Objective range  [2e-02, 1e+00]
  Bounds range     [1e+00, 1e+00]
  RHS range        [1e+00, 1e+02]

Presolve removed 272 rows and 158 columns
Presolve time: 0.00s
Presolved: 473 rows, 277 columns, 1442 nonzeros
Variable types: 9 continuous, 268 integer (201 binary)
Found heuristic solution: objective 315.0000000
Found heuristic solution: objective 314.0000000
Found heuristic solution: objective 104.9596154

Root relaxation: objective 1.596654e-01, 214 iterations, 0.00 seconds (0.00 work units)

    Nodes    |    Current Node    |     Objective Bounds      |     Work
 Expl Unexpl |  Obj  Depth IntInf | Incumbent    BestBd   Gap | It/Node Time

     0     0    0.15967    0   66  104.95962    0.15967   100%     -    0s
H    0     0                      79.9846154    0.15967   100%     -    0s
     0     0    2.48749    0   68   79.98462    2.48749  96.9%     -    0s
H    0     0                      71.9706842    2.65541  96.3%     -    0s
H    0     0                      45.9683654    2.65541  94.2%     -    0s
     0     0    7.14136    0   39   45.96837    7.14136  84.5%     -    0s
     0     0   11.71177    0  106   45.96837   11.71177  74.5%     -    0s
     0     0   11.92775    0  111   45.96837   11.92775  74.1%     -    0s
     0     0   11.92775    0  111   45.96837   11.92775  74.1%     -    0s
     0     0   18.15263    0  125   45.96837   18.15263  60.5%     -    0s
     0     0   20.36535    0  132   45.96837   20.36535  55.7%     -    0s
     0     0   20.59467    0  134   45.96837   20.59467  55.2%     -    0s
     0     0   20.61360    0  142   45.96837   20.61360  55.2%     -    0s
     0     0   20.61660    0  142   45.96837   20.61660  55.2%     -    0s
     0     0   21.71969    0  101   45.96837   21.71969  52.8%     -    0s
     0     0   22.19282    0  100   45.96837   22.19282  51.7%     -    0s
     0     0   22.23042    0  126   45.96837   22.23042  51.6%     -    0s
     0     0   22.64235    0  128   45.96837   22.64235  50.7%     -    0s
     0     0   22.64235    0  131   45.96837   22.64235  50.7%     -    0s
     0     0   25.31737    0  112   45.96837   25.31737  44.9%     -    0s
     0     0   25.57765    0  117   45.96837   25.57765  44.4%     -    0s
     0     0   25.60010    0  131   45.96837   25.60010  44.3%     -    0s
     0     0   25.60515    0  131   45.96837   25.60515  44.3%     -    0s
     0     0   29.37441    0  110   45.96837   29.37441  36.1%     -    0s
     0     0   29.71166    0  123   45.96837   29.71166  35.4%     -    0s
     0     0   29.75374    0  127   45.96837   29.75374  35.3%     -    0s
     0     0   29.77547    0  115   45.96837   29.77547  35.2%     -    0s
     0     0   29.77634    0  112   45.96837   29.77634  35.2%     -    0s
     0     0   30.27311    0  131   45.96837   30.27311  34.1%     -    0s
     0     0   31.03941    0  113   45.96837   31.03941  32.5%     -    0s
     0     0   31.39179    0  119   45.96837   31.39179  31.7%     -    0s
     0     0   31.53152    0   92   45.96837   31.53152  31.4%     -    0s
     0     0   31.53967    0  121   45.96837   31.53967  31.4%     -    0s
     0     0   33.18863    0  114   45.96837   33.18863  27.8%     -    0s
     0     0   33.38513    0  111   45.96837   33.38513  27.4%     -    0s
     0     0   33.40679    0  117   45.96837   33.40679  27.3%     -    0s
     0     0   33.41675    0  111   45.96837   33.41675  27.3%     -    0s
     0     0   34.22482    0  120   45.96837   34.22482  25.5%     -    0s
     0     0   34.64185    0  116   45.96837   34.64185  24.6%     -    0s
     0     0   34.71242    0  129   45.96837   34.71242  24.5%     -    0s
     0     0   34.72529    0  124   45.96837   34.72529  24.5%     -    0s
     0     0   34.72726    0  119   45.96837   34.72726  24.5%     -    0s
     0     0   35.84916    0  121   45.96837   35.84916  22.0%     -    0s
     0     0   36.63099    0  112   45.96837   36.63099  20.3%     -    0s
     0     0   36.77149    0  135   45.96837   36.77149  20.0%     -    0s
     0     0   36.84071    0  141   45.96837   36.84071  19.9%     -    0s
     0     0   36.85191    0  154   45.96837   36.85191  19.8%     -    0s
     0     0   36.90783    0  160   45.96837   36.90783  19.7%     -    0s
     0     0   36.93249    0  148   45.96837   36.93249  19.7%     -    0s
     0     0   36.95026    0  149   45.96837   36.95026  19.6%     -    0s
     0     0   36.95523    0  156   45.96837   36.95523  19.6%     -    0s
     0     0   37.46061    0  156   45.96837   37.46061  18.5%     -    0s
     0     0   37.69006    0  130   45.96837   37.69006  18.0%     -    0s
     0     0   37.73387    0  140   45.96837   37.73387  17.9%     -    0s
     0     0   37.77604    0  144   45.96837   37.77604  17.8%     -    0s
     0     0   37.77685    0  146   45.96837   37.77685  17.8%     -    0s
     0     0   38.17000    0  140   45.96837   38.17000  17.0%     -    0s
     0     0   38.24938    0  130   45.96837   38.24938  16.8%     -    0s
     0     0   38.25083    0  130   45.96837   38.25083  16.8%     -    0s
     0     0   38.76798    0  124   45.96837   38.76798  15.7%     -    0s
     0     0   38.80164    0  114   45.96837   38.80164  15.6%     -    0s
     0     0   38.80844    0  125   45.96837   38.80844  15.6%     -    0s
     0     0   38.80944    0  127   45.96837   38.80944  15.6%     -    0s
     0     0   38.81416    0  127   45.96837   38.81416  15.6%     -    0s
     0     2   38.81416    0  127   45.96837   38.81416  15.6%     -    0s
H  182     0                      45.9683654   43.01368  6.43%  53.5    0s

Cutting planes:
  Learned: 1
  Gomory: 15
  Cover: 27
  Implied bound: 21
  Clique: 1
  MIR: 135
  Flow cover: 113
  Inf proof: 14
  RLT: 1
  Relax-and-lift: 1

Explored 202 nodes (13310 simplex iterations) in 0.28 seconds (0.31 work units)
Thread count was 20 (of 20 available processors)

Solution count 7: 45.9684 45.9684 71.9707 ... 315

Optimal solution found (tolerance 1.00e-04)
Warning: max constraint violation (1.9960e-06) exceeds tolerance
Warning: max bound violation (1.9910e-06) exceeds tolerance
Best objective 4.596836537620e+01, best bound 4.596836537620e+01, gap 0.0000%

H2 Solution:
  Weights (w): [0. 2. 2. 2.]
  Intercept (b): -9.0
  Objective: 45.968365
  Selected features: 4/4
  L1 norm: 6.000000
  Positive accuracy lb: 1.0000
  Negative accuracy lb: 0.6500

============================================================
Training Complete!
============================================================

Training completed in: 0:00:00.714492

================================================================================
Model Summary
================================================================================
Status: fitted
Strategy: test3
Features: 4

Class Roles:
  Majority: Class 2
  Medium:   Class 1
  Minority: Class 3

Classifier 1 (H1): Class 3 vs Class {1, 2}
  Objective: 20.949765
  Selected Features: 4/4
  L1 Norm: 3.000000

Classifier 2 (H2): Class {2, 3} vs Class 1
  Objective: 45.968365
  Selected Features: 4/4
  L1 Norm: 6.000000

================================================================================
H1 Complete Weights and Bias
================================================================================
Description: Class 3 vs Class {1, 2}

Intercept (b): -7.0000000000

Weight vector (w) - 4 features:
  w[0] = 0.0000000000
  w[1] = 1.0000000000
  w[2] = 1.0000000000
  w[3] = 1.0000000000

L1 Norm: 3.0000000000

================================================================================
H2 Complete Weights and Bias
================================================================================
Description: Class {2, 3} vs Class 1

Intercept (b): -9.0000000000

Weight vector (w) - 4 features:
  w[0] = 0.0000000000
  w[1] = 2.0000000000
  w[2] = 2.0000000000
  w[3] = 2.0000000000

L1 Norm: 6.0000000000

================================================================================
Training Set Evaluation
================================================================================


============================================================
Evaluation Results
============================================================

Total Accuracy: 0.8000

Per-Class Accuracy:
  Class 1: 0.6500
  Class 2: 0.8780
  Class 3: 0.9167

Class Distribution:
  Class 1: 40 samples
  Class 2: 41 samples
  Class 3: 24 samples

Confusion Matrix:
     Pred 1  Pred 2  Pred 3
True 1:    26      12       2
True 2:     0      36       5
True 3:     0       2      22
============================================================

================================================================================
Test Set Evaluation
================================================================================


============================================================
Evaluation Results
============================================================

Total Accuracy: 0.6667

Per-Class Accuracy:
  Class 1: 0.3636
  Class 2: 0.9000
  Class 3: 0.8333

Class Distribution:
  Class 1: 11 samples
  Class 2: 10 samples
  Class 3: 6 samples

Confusion Matrix:
     Pred 1  Pred 2  Pred 3
True 1:     4       6       1
True 2:     0       9       1
True 3:     0       1       5
============================================================

================================================================================
Test Complete!
================================================================================
Training Duration: 0:00:00.714492
Training Accuracy: 0.8000
Test Accuracy: 0.6667
Log saved to: /home/bs10081/Developer/hcesvm/results/test3_Hayes_Roth_20260210_193354.log
================================================================================
